<!ELEMENT sports (sport*)>
<!ELEMENT sport (name, technique*)>
<!ATTLIST sport id ID #REQUIRED>
<!ELEMENT name (#PCDATA)>
<!ELEMENT technique (#PCDATA)>